audit_split,subaction_index,narration_id,narration,frame_0_based,hand,status,fail_reason,sample_dir,projection_overlay_raw_vs_snapped,vrb_style_affordance,manual_label,allowed_labels,notes
success,30,P01_109_30,rinse hands,2718.0,left,keep,,/Users/huhu/Documents/Code/bishe/vrb/vrbreproduction/outputs/e13_engineered_homography_100subaction/experiments/E13/pipeline_outputs/subaction_30_P01_109_30/episode_02_left/frame_002718_left,/Users/huhu/Documents/Code/bishe/vrb/vrbreproduction/outputs/e13_engineered_homography_100subaction/experiments/E13/pipeline_outputs/subaction_30_P01_109_30/episode_02_left/frame_002718_left/projection_overlay_raw_vs_snapped.png,/Users/huhu/Documents/Code/bishe/vrb/vrbreproduction/outputs/e13_engineered_homography_100subaction/experiments/E13/pipeline_outputs/subaction_30_P01_109_30/episode_02_left/frame_002718_left/vrb_style_affordance.png,wrong_object,accurate_same_part|same_object_but_shifted|wrong_object|background_or_empty|unclear,Projection concentrates on hands rather than the manipulated surface.
success,30,P01_109_30,rinse hands,2868.0,left,keep,,/Users/huhu/Documents/Code/bishe/vrb/vrbreproduction/outputs/e13_engineered_homography_100subaction/experiments/E13/pipeline_outputs/subaction_30_P01_109_30/episode_17_left/frame_002868_left,/Users/huhu/Documents/Code/bishe/vrb/vrbreproduction/outputs/e13_engineered_homography_100subaction/experiments/E13/pipeline_outputs/subaction_30_P01_109_30/episode_17_left/frame_002868_left/projection_overlay_raw_vs_snapped.png,/Users/huhu/Documents/Code/bishe/vrb/vrbreproduction/outputs/e13_engineered_homography_100subaction/experiments/E13/pipeline_outputs/subaction_30_P01_109_30/episode_17_left/frame_002868_left/vrb_style_affordance.png,wrong_object,accurate_same_part|same_object_but_shifted|wrong_object|background_or_empty|unclear,Projection concentrates on hands rather than the intended object.
success,67,P01_109_67,put down knife,10261.0,right,keep,,/Users/huhu/Documents/Code/bishe/vrb/vrbreproduction/outputs/e13_engineered_homography_100subaction/experiments/E13/pipeline_outputs/subaction_67_P01_109_67/episode_01_right/frame_010261_right,/Users/huhu/Documents/Code/bishe/vrb/vrbreproduction/outputs/e13_engineered_homography_100subaction/experiments/E13/pipeline_outputs/subaction_67_P01_109_67/episode_01_right/frame_010261_right/projection_overlay_raw_vs_snapped.png,/Users/huhu/Documents/Code/bishe/vrb/vrbreproduction/outputs/e13_engineered_homography_100subaction/experiments/E13/pipeline_outputs/subaction_67_P01_109_67/episode_01_right/frame_010261_right/vrb_style_affordance.png,same_object_but_shifted,accurate_same_part|same_object_but_shifted|wrong_object|background_or_empty|unclear,Projection is on the same cutting-board/potato workspace but shifted from the exact part.
success,47,P01_109_47,close cupboard,4648.0,left,keep,,/Users/huhu/Documents/Code/bishe/vrb/vrbreproduction/outputs/e13_engineered_homography_100subaction/experiments/E13/pipeline_outputs/subaction_47_P01_109_47/episode_01_left/frame_004648_left,/Users/huhu/Documents/Code/bishe/vrb/vrbreproduction/outputs/e13_engineered_homography_100subaction/experiments/E13/pipeline_outputs/subaction_47_P01_109_47/episode_01_left/frame_004648_left/projection_overlay_raw_vs_snapped.png,/Users/huhu/Documents/Code/bishe/vrb/vrbreproduction/outputs/e13_engineered_homography_100subaction/experiments/E13/pipeline_outputs/subaction_47_P01_109_47/episode_01_left/frame_004648_left/vrb_style_affordance.png,accurate_same_part,accurate_same_part|same_object_but_shifted|wrong_object|background_or_empty|unclear,Projection remains on the intended object/contact part.
success,38,P01_109_38,move potatoes,3654.0,left,keep,,/Users/huhu/Documents/Code/bishe/vrb/vrbreproduction/outputs/e13_engineered_homography_100subaction/experiments/E13/pipeline_outputs/subaction_38_P01_109_38/episode_01_left/frame_003654_left,/Users/huhu/Documents/Code/bishe/vrb/vrbreproduction/outputs/e13_engineered_homography_100subaction/experiments/E13/pipeline_outputs/subaction_38_P01_109_38/episode_01_left/frame_003654_left/projection_overlay_raw_vs_snapped.png,/Users/huhu/Documents/Code/bishe/vrb/vrbreproduction/outputs/e13_engineered_homography_100subaction/experiments/E13/pipeline_outputs/subaction_38_P01_109_38/episode_01_left/frame_003654_left/vrb_style_affordance.png,accurate_same_part,accurate_same_part|same_object_but_shifted|wrong_object|background_or_empty|unclear,Projection remains on the intended object/contact part.
failure,9,P01_109_9,put down potato,687.0,left,discard,no_pre_episode_reference_window,/Users/huhu/Documents/Code/bishe/vrb/vrbreproduction/outputs/e13_engineered_homography_100subaction/experiments/E13/pipeline_outputs/subaction_09_P01_109_9/episode_07_left/frame_000687_left,,,unclear,accurate_same_part|same_object_but_shifted|wrong_object|background_or_empty|unclear,Failure candidate exited before a final projection artifact was produced; fail reason used as context only.
failure,8,P01_109_7,put down potatoes,689.0,left,discard,no_pre_episode_reference_window,/Users/huhu/Documents/Code/bishe/vrb/vrbreproduction/outputs/e13_engineered_homography_100subaction/experiments/E13/pipeline_outputs/subaction_08_P01_109_7/episode_08_left/frame_000689_left,,,unclear,accurate_same_part|same_object_but_shifted|wrong_object|background_or_empty|unclear,Failure candidate exited before a final projection artifact was produced; fail reason used as context only.
failure,1,P01_109_1,open rucksack,178.0,right,discard,no_pre_episode_reference_window,/Users/huhu/Documents/Code/bishe/vrb/vrbreproduction/outputs/e13_engineered_homography_100subaction/experiments/E13/pipeline_outputs/subaction_01_P01_109_1/episode_05_right/frame_000178_right,,,unclear,accurate_same_part|same_object_but_shifted|wrong_object|background_or_empty|unclear,Failure candidate exited before a final projection artifact was produced; fail reason used as context only.
failure,8,P01_109_7,put down potatoes,657.0,left,discard,no_pre_episode_reference_window,/Users/huhu/Documents/Code/bishe/vrb/vrbreproduction/outputs/e13_engineered_homography_100subaction/experiments/E13/pipeline_outputs/subaction_08_P01_109_7/episode_05_left/frame_000657_left,,,unclear,accurate_same_part|same_object_but_shifted|wrong_object|background_or_empty|unclear,Failure candidate exited before a final projection artifact was produced; fail reason used as context only.
failure,20,P01_109_20,close door,1852.0,right,discard,missing_hand_or_object_bbox,/Users/huhu/Documents/Code/bishe/vrb/vrbreproduction/outputs/e13_engineered_homography_100subaction/experiments/E13/pipeline_outputs/subaction_20_P01_109_20/episode_04_right/frame_001852_right,,,unclear,accurate_same_part|same_object_but_shifted|wrong_object|background_or_empty|unclear,Failure candidate exited before a final projection artifact was produced; fail reason used as context only.
failure,62,P01_109_62,grab potato,,,discard,continuation_contact_run,,,,unclear,accurate_same_part|same_object_but_shifted|wrong_object|background_or_empty|unclear,Failure candidate exited before a final projection artifact was produced; fail reason used as context only.
failure,6,P01_109_8,pick up potato,528.0,left,discard,no_pre_episode_reference_window,/Users/huhu/Documents/Code/bishe/vrb/vrbreproduction/outputs/e13_engineered_homography_100subaction/experiments/E13/pipeline_outputs/subaction_06_P01_109_8/episode_02_left/frame_000528_left,,,unclear,accurate_same_part|same_object_but_shifted|wrong_object|background_or_empty|unclear,Failure candidate exited before a final projection artifact was produced; fail reason used as context only.
failure,43,P01_109_44,put down pan,4275.0,left,discard,no_pre_episode_reference_window,/Users/huhu/Documents/Code/bishe/vrb/vrbreproduction/outputs/e13_engineered_homography_100subaction/experiments/E13/pipeline_outputs/subaction_43_P01_109_44/episode_01_left/frame_004275_left,,,unclear,accurate_same_part|same_object_but_shifted|wrong_object|background_or_empty|unclear,Failure candidate exited before a final projection artifact was produced; fail reason used as context only.
failure,44,P01_109_43,pick up pan,4381.0,left,discard,no_pre_episode_reference_window,/Users/huhu/Documents/Code/bishe/vrb/vrbreproduction/outputs/e13_engineered_homography_100subaction/experiments/E13/pipeline_outputs/subaction_44_P01_109_43/episode_02_left/frame_004381_left,,,unclear,accurate_same_part|same_object_but_shifted|wrong_object|background_or_empty|unclear,Failure candidate exited before a final projection artifact was produced; fail reason used as context only.
failure,56,P01_109_56,pick up potato,5119.0,right,discard,contact_points_lt5_after_object_boundary_filter,/Users/huhu/Documents/Code/bishe/vrb/vrbreproduction/outputs/e13_engineered_homography_100subaction/experiments/E13/pipeline_outputs/subaction_56_P01_109_56/episode_04_right/frame_005119_right,,,unclear,accurate_same_part|same_object_but_shifted|wrong_object|background_or_empty|unclear,Failure candidate exited before a final projection artifact was produced; fail reason used as context only.
failure,66,P01_109_66,move cutting board,10198.0,left,discard,no_pre_episode_reference_window,/Users/huhu/Documents/Code/bishe/vrb/vrbreproduction/outputs/e13_engineered_homography_100subaction/experiments/E13/pipeline_outputs/subaction_66_P01_109_66/episode_01_left/frame_010198_left,,,unclear,accurate_same_part|same_object_but_shifted|wrong_object|background_or_empty|unclear,Failure candidate exited before a final projection artifact was produced; fail reason used as context only.
failure,94,P01_109_94,peel potato,,,discard,continuation_contact_run,,,,unclear,accurate_same_part|same_object_but_shifted|wrong_object|background_or_empty|unclear,Failure candidate exited before a final projection artifact was produced; fail reason used as context only.
failure,9,P01_109_9,put down potato,658.0,left,discard,contact_points_lt5_after_object_boundary_filter,/Users/huhu/Documents/Code/bishe/vrb/vrbreproduction/outputs/e13_engineered_homography_100subaction/experiments/E13/pipeline_outputs/subaction_09_P01_109_9/episode_05_left/frame_000658_left,,,unclear,accurate_same_part|same_object_but_shifted|wrong_object|background_or_empty|unclear,Failure candidate exited before a final projection artifact was produced; fail reason used as context only.
failure,30,P01_109_30,rinse hands,2751.0,left,discard,projected_contact_too_far_from_reference_object_mask,/Users/huhu/Documents/Code/bishe/vrb/vrbreproduction/outputs/e13_engineered_homography_100subaction/experiments/E13/pipeline_outputs/subaction_30_P01_109_30/episode_05_left/frame_002751_left,,,unclear,accurate_same_part|same_object_but_shifted|wrong_object|background_or_empty|unclear,Failure candidate exited before a final projection artifact was produced; fail reason used as context only.
failure,82,P01_109_82,pick up potato slice,12494.0,right,discard,no_pre_episode_reference_window,/Users/huhu/Documents/Code/bishe/vrb/vrbreproduction/outputs/e13_engineered_homography_100subaction/experiments/E13/pipeline_outputs/subaction_82_P01_109_82/episode_01_right/frame_012494_right,,,unclear,accurate_same_part|same_object_but_shifted|wrong_object|background_or_empty|unclear,Failure candidate exited before a final projection artifact was produced; fail reason used as context only.
failure,82,P01_109_82,pick up potato slice,12493.0,right,discard,no_pre_episode_reference_window,/Users/huhu/Documents/Code/bishe/vrb/vrbreproduction/outputs/e13_engineered_homography_100subaction/experiments/E13/pipeline_outputs/subaction_82_P01_109_82/episode_01_right/frame_012493_right,,,unclear,accurate_same_part|same_object_but_shifted|wrong_object|background_or_empty|unclear,Failure candidate exited before a final projection artifact was produced; fail reason used as context only.
failure,44,P01_109_43,pick up pan,4381.0,right,discard,projected_contact_too_far_from_reference_object_mask,/Users/huhu/Documents/Code/bishe/vrb/vrbreproduction/outputs/e13_engineered_homography_100subaction/experiments/E13/pipeline_outputs/subaction_44_P01_109_43/episode_01_right/frame_004381_right,,,unclear,accurate_same_part|same_object_but_shifted|wrong_object|background_or_empty|unclear,Failure candidate exited before a final projection artifact was produced; fail reason used as context only.
failure,8,P01_109_7,put down potatoes,639.0,right,discard,no_pre_episode_reference_window,/Users/huhu/Documents/Code/bishe/vrb/vrbreproduction/outputs/e13_engineered_homography_100subaction/experiments/E13/pipeline_outputs/subaction_08_P01_109_7/episode_03_right/frame_000639_right,,,unclear,accurate_same_part|same_object_but_shifted|wrong_object|background_or_empty|unclear,Failure candidate exited before a final projection artifact was produced; fail reason used as context only.
failure,16,P01_109_16,close drawer,1354.0,right,discard,no_pre_episode_reference_window,/Users/huhu/Documents/Code/bishe/vrb/vrbreproduction/outputs/e13_engineered_homography_100subaction/experiments/E13/pipeline_outputs/subaction_16_P01_109_16/episode_03_right/frame_001354_right,,,unclear,accurate_same_part|same_object_but_shifted|wrong_object|background_or_empty|unclear,Failure candidate exited before a final projection artifact was produced; fail reason used as context only.
failure,10,P01_109_10,pick up beers,785.0,left,discard,contact_points_lt5_after_object_boundary_filter,/Users/huhu/Documents/Code/bishe/vrb/vrbreproduction/outputs/e13_engineered_homography_100subaction/experiments/E13/pipeline_outputs/subaction_10_P01_109_10/episode_03_left/frame_000785_left,,,unclear,accurate_same_part|same_object_but_shifted|wrong_object|background_or_empty|unclear,Failure candidate exited before a final projection artifact was produced; fail reason used as context only.
