audit_split,subaction_index,narration_id,narration,frame_0_based,hand,status,fail_reason,sample_dir,projection_overlay_raw_vs_snapped,vrb_style_affordance,manual_label,allowed_labels,notes
success,34,P01_109_34,dry hands,3197.0,left,keep,,/Users/huhu/Documents/Code/bishe/vrb/vrbreproduction/outputs/e13_engineered_homography_100subaction/experiments/E13/pipeline_outputs/subaction_34_P01_109_34/episode_10_left/frame_003197_left,/Users/huhu/Documents/Code/bishe/vrb/vrbreproduction/outputs/e13_engineered_homography_100subaction/experiments/E13/pipeline_outputs/subaction_34_P01_109_34/episode_10_left/frame_003197_left/projection_overlay_raw_vs_snapped.png,/Users/huhu/Documents/Code/bishe/vrb/vrbreproduction/outputs/e13_engineered_homography_100subaction/experiments/E13/pipeline_outputs/subaction_34_P01_109_34/episode_10_left/frame_003197_left/vrb_style_affordance.png,,accurate_same_part|same_object_but_shifted|wrong_object|background_or_empty|unclear,
success,30,P01_109_30,rinse hands,2852.0,left,keep,,/Users/huhu/Documents/Code/bishe/vrb/vrbreproduction/outputs/e13_engineered_homography_100subaction/experiments/E13/pipeline_outputs/subaction_30_P01_109_30/episode_15_left/frame_002852_left,/Users/huhu/Documents/Code/bishe/vrb/vrbreproduction/outputs/e13_engineered_homography_100subaction/experiments/E13/pipeline_outputs/subaction_30_P01_109_30/episode_15_left/frame_002852_left/projection_overlay_raw_vs_snapped.png,/Users/huhu/Documents/Code/bishe/vrb/vrbreproduction/outputs/e13_engineered_homography_100subaction/experiments/E13/pipeline_outputs/subaction_30_P01_109_30/episode_15_left/frame_002852_left/vrb_style_affordance.png,,accurate_same_part|same_object_but_shifted|wrong_object|background_or_empty|unclear,
success,1,P01_109_1,open rucksack,199.0,right,keep,,/Users/huhu/Documents/Code/bishe/vrb/vrbreproduction/outputs/e13_engineered_homography_100subaction/experiments/E13/pipeline_outputs/subaction_01_P01_109_1/episode_07_right/frame_000199_right,/Users/huhu/Documents/Code/bishe/vrb/vrbreproduction/outputs/e13_engineered_homography_100subaction/experiments/E13/pipeline_outputs/subaction_01_P01_109_1/episode_07_right/frame_000199_right/projection_overlay_raw_vs_snapped.png,/Users/huhu/Documents/Code/bishe/vrb/vrbreproduction/outputs/e13_engineered_homography_100subaction/experiments/E13/pipeline_outputs/subaction_01_P01_109_1/episode_07_right/frame_000199_right/vrb_style_affordance.png,,accurate_same_part|same_object_but_shifted|wrong_object|background_or_empty|unclear,
success,34,P01_109_34,dry hands,3338.0,right,keep,,/Users/huhu/Documents/Code/bishe/vrb/vrbreproduction/outputs/e13_engineered_homography_100subaction/experiments/E13/pipeline_outputs/subaction_34_P01_109_34/episode_21_right/frame_003338_right,/Users/huhu/Documents/Code/bishe/vrb/vrbreproduction/outputs/e13_engineered_homography_100subaction/experiments/E13/pipeline_outputs/subaction_34_P01_109_34/episode_21_right/frame_003338_right/projection_overlay_raw_vs_snapped.png,/Users/huhu/Documents/Code/bishe/vrb/vrbreproduction/outputs/e13_engineered_homography_100subaction/experiments/E13/pipeline_outputs/subaction_34_P01_109_34/episode_21_right/frame_003338_right/vrb_style_affordance.png,,accurate_same_part|same_object_but_shifted|wrong_object|background_or_empty|unclear,
success,30,P01_109_30,rinse hands,2708.0,left,keep,,/Users/huhu/Documents/Code/bishe/vrb/vrbreproduction/outputs/e13_engineered_homography_100subaction/experiments/E13/pipeline_outputs/subaction_30_P01_109_30/episode_01_left/frame_002708_left,/Users/huhu/Documents/Code/bishe/vrb/vrbreproduction/outputs/e13_engineered_homography_100subaction/experiments/E13/pipeline_outputs/subaction_30_P01_109_30/episode_01_left/frame_002708_left/projection_overlay_raw_vs_snapped.png,/Users/huhu/Documents/Code/bishe/vrb/vrbreproduction/outputs/e13_engineered_homography_100subaction/experiments/E13/pipeline_outputs/subaction_30_P01_109_30/episode_01_left/frame_002708_left/vrb_style_affordance.png,,accurate_same_part|same_object_but_shifted|wrong_object|background_or_empty|unclear,
success,16,P01_109_16,close drawer,1357.0,left,keep,,/Users/huhu/Documents/Code/bishe/vrb/vrbreproduction/outputs/e13_engineered_homography_100subaction/experiments/E13/pipeline_outputs/subaction_16_P01_109_16/episode_05_left/frame_001357_left,/Users/huhu/Documents/Code/bishe/vrb/vrbreproduction/outputs/e13_engineered_homography_100subaction/experiments/E13/pipeline_outputs/subaction_16_P01_109_16/episode_05_left/frame_001357_left/projection_overlay_raw_vs_snapped.png,/Users/huhu/Documents/Code/bishe/vrb/vrbreproduction/outputs/e13_engineered_homography_100subaction/experiments/E13/pipeline_outputs/subaction_16_P01_109_16/episode_05_left/frame_001357_left/vrb_style_affordance.png,,accurate_same_part|same_object_but_shifted|wrong_object|background_or_empty|unclear,
success,34,P01_109_34,dry hands,3247.0,right,keep,,/Users/huhu/Documents/Code/bishe/vrb/vrbreproduction/outputs/e13_engineered_homography_100subaction/experiments/E13/pipeline_outputs/subaction_34_P01_109_34/episode_14_right/frame_003247_right,/Users/huhu/Documents/Code/bishe/vrb/vrbreproduction/outputs/e13_engineered_homography_100subaction/experiments/E13/pipeline_outputs/subaction_34_P01_109_34/episode_14_right/frame_003247_right/projection_overlay_raw_vs_snapped.png,/Users/huhu/Documents/Code/bishe/vrb/vrbreproduction/outputs/e13_engineered_homography_100subaction/experiments/E13/pipeline_outputs/subaction_34_P01_109_34/episode_14_right/frame_003247_right/vrb_style_affordance.png,,accurate_same_part|same_object_but_shifted|wrong_object|background_or_empty|unclear,
success,34,P01_109_34,dry hands,3308.0,right,keep,,/Users/huhu/Documents/Code/bishe/vrb/vrbreproduction/outputs/e13_engineered_homography_100subaction/experiments/E13/pipeline_outputs/subaction_34_P01_109_34/episode_20_right/frame_003308_right,/Users/huhu/Documents/Code/bishe/vrb/vrbreproduction/outputs/e13_engineered_homography_100subaction/experiments/E13/pipeline_outputs/subaction_34_P01_109_34/episode_20_right/frame_003308_right/projection_overlay_raw_vs_snapped.png,/Users/huhu/Documents/Code/bishe/vrb/vrbreproduction/outputs/e13_engineered_homography_100subaction/experiments/E13/pipeline_outputs/subaction_34_P01_109_34/episode_20_right/frame_003308_right/vrb_style_affordance.png,,accurate_same_part|same_object_but_shifted|wrong_object|background_or_empty|unclear,
success,40,P01_109_40,move pans,3855.0,right,keep,,/Users/huhu/Documents/Code/bishe/vrb/vrbreproduction/outputs/e13_engineered_homography_100subaction/experiments/E13/pipeline_outputs/subaction_40_P01_109_40/episode_04_right/frame_003855_right,/Users/huhu/Documents/Code/bishe/vrb/vrbreproduction/outputs/e13_engineered_homography_100subaction/experiments/E13/pipeline_outputs/subaction_40_P01_109_40/episode_04_right/frame_003855_right/projection_overlay_raw_vs_snapped.png,/Users/huhu/Documents/Code/bishe/vrb/vrbreproduction/outputs/e13_engineered_homography_100subaction/experiments/E13/pipeline_outputs/subaction_40_P01_109_40/episode_04_right/frame_003855_right/vrb_style_affordance.png,,accurate_same_part|same_object_but_shifted|wrong_object|background_or_empty|unclear,
success,45,P01_109_45,put down pan,4380.0,right,keep,,/Users/huhu/Documents/Code/bishe/vrb/vrbreproduction/outputs/e13_engineered_homography_100subaction/experiments/E13/pipeline_outputs/subaction_45_P01_109_45/episode_01_right/frame_004380_right,/Users/huhu/Documents/Code/bishe/vrb/vrbreproduction/outputs/e13_engineered_homography_100subaction/experiments/E13/pipeline_outputs/subaction_45_P01_109_45/episode_01_right/frame_004380_right/projection_overlay_raw_vs_snapped.png,/Users/huhu/Documents/Code/bishe/vrb/vrbreproduction/outputs/e13_engineered_homography_100subaction/experiments/E13/pipeline_outputs/subaction_45_P01_109_45/episode_01_right/frame_004380_right/vrb_style_affordance.png,,accurate_same_part|same_object_but_shifted|wrong_object|background_or_empty|unclear,
success,13,P01_109_13,put beer into drawer,1272.0,right,keep,,/Users/huhu/Documents/Code/bishe/vrb/vrbreproduction/outputs/e13_engineered_homography_100subaction/experiments/E13/pipeline_outputs/subaction_13_P01_109_13/episode_07_right/frame_001272_right,/Users/huhu/Documents/Code/bishe/vrb/vrbreproduction/outputs/e13_engineered_homography_100subaction/experiments/E13/pipeline_outputs/subaction_13_P01_109_13/episode_07_right/frame_001272_right/projection_overlay_raw_vs_snapped.png,/Users/huhu/Documents/Code/bishe/vrb/vrbreproduction/outputs/e13_engineered_homography_100subaction/experiments/E13/pipeline_outputs/subaction_13_P01_109_13/episode_07_right/frame_001272_right/vrb_style_affordance.png,,accurate_same_part|same_object_but_shifted|wrong_object|background_or_empty|unclear,
success,3,P01_109_3,put down eggs,370.0,left,keep,,/Users/huhu/Documents/Code/bishe/vrb/vrbreproduction/outputs/e13_engineered_homography_100subaction/experiments/E13/pipeline_outputs/subaction_03_P01_109_3/episode_02_left/frame_000370_left,/Users/huhu/Documents/Code/bishe/vrb/vrbreproduction/outputs/e13_engineered_homography_100subaction/experiments/E13/pipeline_outputs/subaction_03_P01_109_3/episode_02_left/frame_000370_left/projection_overlay_raw_vs_snapped.png,/Users/huhu/Documents/Code/bishe/vrb/vrbreproduction/outputs/e13_engineered_homography_100subaction/experiments/E13/pipeline_outputs/subaction_03_P01_109_3/episode_02_left/frame_000370_left/vrb_style_affordance.png,,accurate_same_part|same_object_but_shifted|wrong_object|background_or_empty|unclear,
success,0,P01_109_0,grab rucksack,88.0,left,keep,,/Users/huhu/Documents/Code/bishe/vrb/vrbreproduction/outputs/e13_engineered_homography_100subaction/experiments/E13/pipeline_outputs/subaction_00_P01_109_0/episode_01_left/frame_000088_left,/Users/huhu/Documents/Code/bishe/vrb/vrbreproduction/outputs/e13_engineered_homography_100subaction/experiments/E13/pipeline_outputs/subaction_00_P01_109_0/episode_01_left/frame_000088_left/projection_overlay_raw_vs_snapped.png,/Users/huhu/Documents/Code/bishe/vrb/vrbreproduction/outputs/e13_engineered_homography_100subaction/experiments/E13/pipeline_outputs/subaction_00_P01_109_0/episode_01_left/frame_000088_left/vrb_style_affordance.png,,accurate_same_part|same_object_but_shifted|wrong_object|background_or_empty|unclear,
success,76,P01_109_76,pick up potato slice,12325.0,right,keep,,/Users/huhu/Documents/Code/bishe/vrb/vrbreproduction/outputs/e13_engineered_homography_100subaction/experiments/E13/pipeline_outputs/subaction_76_P01_109_76/episode_01_right/frame_012325_right,/Users/huhu/Documents/Code/bishe/vrb/vrbreproduction/outputs/e13_engineered_homography_100subaction/experiments/E13/pipeline_outputs/subaction_76_P01_109_76/episode_01_right/frame_012325_right/projection_overlay_raw_vs_snapped.png,/Users/huhu/Documents/Code/bishe/vrb/vrbreproduction/outputs/e13_engineered_homography_100subaction/experiments/E13/pipeline_outputs/subaction_76_P01_109_76/episode_01_right/frame_012325_right/vrb_style_affordance.png,,accurate_same_part|same_object_but_shifted|wrong_object|background_or_empty|unclear,
success,75,P01_109_75,put down potato slices,12325.0,right,keep,,/Users/huhu/Documents/Code/bishe/vrb/vrbreproduction/outputs/e13_engineered_homography_100subaction/experiments/E13/pipeline_outputs/subaction_75_P01_109_75/episode_02_right/frame_012325_right,/Users/huhu/Documents/Code/bishe/vrb/vrbreproduction/outputs/e13_engineered_homography_100subaction/experiments/E13/pipeline_outputs/subaction_75_P01_109_75/episode_02_right/frame_012325_right/projection_overlay_raw_vs_snapped.png,/Users/huhu/Documents/Code/bishe/vrb/vrbreproduction/outputs/e13_engineered_homography_100subaction/experiments/E13/pipeline_outputs/subaction_75_P01_109_75/episode_02_right/frame_012325_right/vrb_style_affordance.png,,accurate_same_part|same_object_but_shifted|wrong_object|background_or_empty|unclear,
success,76,P01_109_76,pick up potato slice,12327.0,right,keep,,/Users/huhu/Documents/Code/bishe/vrb/vrbreproduction/outputs/e13_engineered_homography_100subaction/experiments/E13/pipeline_outputs/subaction_76_P01_109_76/episode_01_right/frame_012327_right,/Users/huhu/Documents/Code/bishe/vrb/vrbreproduction/outputs/e13_engineered_homography_100subaction/experiments/E13/pipeline_outputs/subaction_76_P01_109_76/episode_01_right/frame_012327_right/projection_overlay_raw_vs_snapped.png,/Users/huhu/Documents/Code/bishe/vrb/vrbreproduction/outputs/e13_engineered_homography_100subaction/experiments/E13/pipeline_outputs/subaction_76_P01_109_76/episode_01_right/frame_012327_right/vrb_style_affordance.png,,accurate_same_part|same_object_but_shifted|wrong_object|background_or_empty|unclear,
success,32,P01_109_32,shake hands,3009.0,left,keep,,/Users/huhu/Documents/Code/bishe/vrb/vrbreproduction/outputs/e13_engineered_homography_100subaction/experiments/E13/pipeline_outputs/subaction_32_P01_109_32/episode_01_left/frame_003009_left,/Users/huhu/Documents/Code/bishe/vrb/vrbreproduction/outputs/e13_engineered_homography_100subaction/experiments/E13/pipeline_outputs/subaction_32_P01_109_32/episode_01_left/frame_003009_left/projection_overlay_raw_vs_snapped.png,/Users/huhu/Documents/Code/bishe/vrb/vrbreproduction/outputs/e13_engineered_homography_100subaction/experiments/E13/pipeline_outputs/subaction_32_P01_109_32/episode_01_left/frame_003009_left/vrb_style_affordance.png,,accurate_same_part|same_object_but_shifted|wrong_object|background_or_empty|unclear,
success,34,P01_109_34,dry hands,3187.0,right,keep,,/Users/huhu/Documents/Code/bishe/vrb/vrbreproduction/outputs/e13_engineered_homography_100subaction/experiments/E13/pipeline_outputs/subaction_34_P01_109_34/episode_08_right/frame_003187_right,/Users/huhu/Documents/Code/bishe/vrb/vrbreproduction/outputs/e13_engineered_homography_100subaction/experiments/E13/pipeline_outputs/subaction_34_P01_109_34/episode_08_right/frame_003187_right/projection_overlay_raw_vs_snapped.png,/Users/huhu/Documents/Code/bishe/vrb/vrbreproduction/outputs/e13_engineered_homography_100subaction/experiments/E13/pipeline_outputs/subaction_34_P01_109_34/episode_08_right/frame_003187_right/vrb_style_affordance.png,,accurate_same_part|same_object_but_shifted|wrong_object|background_or_empty|unclear,
success,1,P01_109_1,open rucksack,198.0,right,keep,,/Users/huhu/Documents/Code/bishe/vrb/vrbreproduction/outputs/e13_engineered_homography_100subaction/experiments/E13/pipeline_outputs/subaction_01_P01_109_1/episode_07_right/frame_000198_right,/Users/huhu/Documents/Code/bishe/vrb/vrbreproduction/outputs/e13_engineered_homography_100subaction/experiments/E13/pipeline_outputs/subaction_01_P01_109_1/episode_07_right/frame_000198_right/projection_overlay_raw_vs_snapped.png,/Users/huhu/Documents/Code/bishe/vrb/vrbreproduction/outputs/e13_engineered_homography_100subaction/experiments/E13/pipeline_outputs/subaction_01_P01_109_1/episode_07_right/frame_000198_right/vrb_style_affordance.png,,accurate_same_part|same_object_but_shifted|wrong_object|background_or_empty|unclear,
success,38,P01_109_38,move potatoes,3655.0,left,keep,,/Users/huhu/Documents/Code/bishe/vrb/vrbreproduction/outputs/e13_engineered_homography_100subaction/experiments/E13/pipeline_outputs/subaction_38_P01_109_38/episode_01_left/frame_003655_left,/Users/huhu/Documents/Code/bishe/vrb/vrbreproduction/outputs/e13_engineered_homography_100subaction/experiments/E13/pipeline_outputs/subaction_38_P01_109_38/episode_01_left/frame_003655_left/projection_overlay_raw_vs_snapped.png,/Users/huhu/Documents/Code/bishe/vrb/vrbreproduction/outputs/e13_engineered_homography_100subaction/experiments/E13/pipeline_outputs/subaction_38_P01_109_38/episode_01_left/frame_003655_left/vrb_style_affordance.png,,accurate_same_part|same_object_but_shifted|wrong_object|background_or_empty|unclear,
success,34,P01_109_34,dry hands,3196.0,left,keep,,/Users/huhu/Documents/Code/bishe/vrb/vrbreproduction/outputs/e13_engineered_homography_100subaction/experiments/E13/pipeline_outputs/subaction_34_P01_109_34/episode_10_left/frame_003196_left,/Users/huhu/Documents/Code/bishe/vrb/vrbreproduction/outputs/e13_engineered_homography_100subaction/experiments/E13/pipeline_outputs/subaction_34_P01_109_34/episode_10_left/frame_003196_left/projection_overlay_raw_vs_snapped.png,/Users/huhu/Documents/Code/bishe/vrb/vrbreproduction/outputs/e13_engineered_homography_100subaction/experiments/E13/pipeline_outputs/subaction_34_P01_109_34/episode_10_left/frame_003196_left/vrb_style_affordance.png,,accurate_same_part|same_object_but_shifted|wrong_object|background_or_empty|unclear,
success,20,P01_109_20,close door,1862.0,right,keep,,/Users/huhu/Documents/Code/bishe/vrb/vrbreproduction/outputs/e13_engineered_homography_100subaction/experiments/E13/pipeline_outputs/subaction_20_P01_109_20/episode_05_right/frame_001862_right,/Users/huhu/Documents/Code/bishe/vrb/vrbreproduction/outputs/e13_engineered_homography_100subaction/experiments/E13/pipeline_outputs/subaction_20_P01_109_20/episode_05_right/frame_001862_right/projection_overlay_raw_vs_snapped.png,/Users/huhu/Documents/Code/bishe/vrb/vrbreproduction/outputs/e13_engineered_homography_100subaction/experiments/E13/pipeline_outputs/subaction_20_P01_109_20/episode_05_right/frame_001862_right/vrb_style_affordance.png,,accurate_same_part|same_object_but_shifted|wrong_object|background_or_empty|unclear,
success,9,P01_109_9,put down potato,734.0,right,keep,,/Users/huhu/Documents/Code/bishe/vrb/vrbreproduction/outputs/e13_engineered_homography_100subaction/experiments/E13/pipeline_outputs/subaction_09_P01_109_9/episode_11_right/frame_000734_right,/Users/huhu/Documents/Code/bishe/vrb/vrbreproduction/outputs/e13_engineered_homography_100subaction/experiments/E13/pipeline_outputs/subaction_09_P01_109_9/episode_11_right/frame_000734_right/projection_overlay_raw_vs_snapped.png,/Users/huhu/Documents/Code/bishe/vrb/vrbreproduction/outputs/e13_engineered_homography_100subaction/experiments/E13/pipeline_outputs/subaction_09_P01_109_9/episode_11_right/frame_000734_right/vrb_style_affordance.png,,accurate_same_part|same_object_but_shifted|wrong_object|background_or_empty|unclear,
success,17,P01_109_17,close freezer,1423.0,left,keep,,/Users/huhu/Documents/Code/bishe/vrb/vrbreproduction/outputs/e13_engineered_homography_100subaction/experiments/E13/pipeline_outputs/subaction_17_P01_109_17/episode_01_left/frame_001423_left,/Users/huhu/Documents/Code/bishe/vrb/vrbreproduction/outputs/e13_engineered_homography_100subaction/experiments/E13/pipeline_outputs/subaction_17_P01_109_17/episode_01_left/frame_001423_left/projection_overlay_raw_vs_snapped.png,/Users/huhu/Documents/Code/bishe/vrb/vrbreproduction/outputs/e13_engineered_homography_100subaction/experiments/E13/pipeline_outputs/subaction_17_P01_109_17/episode_01_left/frame_001423_left/vrb_style_affordance.png,,accurate_same_part|same_object_but_shifted|wrong_object|background_or_empty|unclear,
success,34,P01_109_34,dry hands,3176.0,right,keep,,/Users/huhu/Documents/Code/bishe/vrb/vrbreproduction/outputs/e13_engineered_homography_100subaction/experiments/E13/pipeline_outputs/subaction_34_P01_109_34/episode_06_right/frame_003176_right,/Users/huhu/Documents/Code/bishe/vrb/vrbreproduction/outputs/e13_engineered_homography_100subaction/experiments/E13/pipeline_outputs/subaction_34_P01_109_34/episode_06_right/frame_003176_right/projection_overlay_raw_vs_snapped.png,/Users/huhu/Documents/Code/bishe/vrb/vrbreproduction/outputs/e13_engineered_homography_100subaction/experiments/E13/pipeline_outputs/subaction_34_P01_109_34/episode_06_right/frame_003176_right/vrb_style_affordance.png,,accurate_same_part|same_object_but_shifted|wrong_object|background_or_empty|unclear,
success,30,P01_109_30,rinse hands,2718.0,left,keep,,/Users/huhu/Documents/Code/bishe/vrb/vrbreproduction/outputs/e13_engineered_homography_100subaction/experiments/E13/pipeline_outputs/subaction_30_P01_109_30/episode_02_left/frame_002718_left,/Users/huhu/Documents/Code/bishe/vrb/vrbreproduction/outputs/e13_engineered_homography_100subaction/experiments/E13/pipeline_outputs/subaction_30_P01_109_30/episode_02_left/frame_002718_left/projection_overlay_raw_vs_snapped.png,/Users/huhu/Documents/Code/bishe/vrb/vrbreproduction/outputs/e13_engineered_homography_100subaction/experiments/E13/pipeline_outputs/subaction_30_P01_109_30/episode_02_left/frame_002718_left/vrb_style_affordance.png,,accurate_same_part|same_object_but_shifted|wrong_object|background_or_empty|unclear,
success,30,P01_109_30,rinse hands,2868.0,left,keep,,/Users/huhu/Documents/Code/bishe/vrb/vrbreproduction/outputs/e13_engineered_homography_100subaction/experiments/E13/pipeline_outputs/subaction_30_P01_109_30/episode_17_left/frame_002868_left,/Users/huhu/Documents/Code/bishe/vrb/vrbreproduction/outputs/e13_engineered_homography_100subaction/experiments/E13/pipeline_outputs/subaction_30_P01_109_30/episode_17_left/frame_002868_left/projection_overlay_raw_vs_snapped.png,/Users/huhu/Documents/Code/bishe/vrb/vrbreproduction/outputs/e13_engineered_homography_100subaction/experiments/E13/pipeline_outputs/subaction_30_P01_109_30/episode_17_left/frame_002868_left/vrb_style_affordance.png,,accurate_same_part|same_object_but_shifted|wrong_object|background_or_empty|unclear,
